<!ELEMENT llistacomandes (comanda*)>
<!ELEMENT comanda (numeroSerie, quantitat, pes?)>
<!ELEMENT numeroSerie (#PCDATA)>
<!ELEMENT quantitat (#PCDATA)>
<!ELEMENT pes (#PCDATA)>